{
  "$schema": "../mcuSchema.json",
  "partInfo": {
    "partNumber": "nRF54L15-QFAA",
    "packageType": "QFN-48",
    "sizeDescription": "6x6x0.85mm, 0.4mm pitch QFN-48",
    "datasheetVersion": "https://docs-be.nordicsemi.com/bundle/ps_nrf54L15/page/pdf/nRF54L15_nRF54L10_nRF54L05_Preliminary_Datasheet_v0.9.pdf"
  },
  "renderConfig": {
    "canvasDefaults": {
        "padding": 20
    },
    "chipBody": {
        "width": 6,
        "height": 6,
        "centerX": 0,
        "centerY": 0,
        "cornerRadius": 0.3,
        "fillColor": "#4A4A4A",
        "strokeColor": "#222222",
        "strokeWidth": 0.5,
        "orientationMarker": {
            "size": 0.3,
            "fillColor": "#FFFFFF",
            "offsetX": -3.6,
            "offsetY": 2.7
        }
    },
    "layoutStrategy": {
        "layoutType": "quadPerimeter",
        "pinCounts": {
            "bottom": 12,
            "left": 12,
            "right": 12,
            "top": 12
        },
        "numberingStart": {
            "corner": "topLeft",
            "direction": "counterClockwise",
            "side": "left"
        },
        "pinOffsetFromEdge": 0,
        "pinPitch": 0.4
    },
    "pinDefaults": {
        "shape": "rect",
        "width": 0.1,
        "height": 0.2,
        "fillColor": "#B0B0B0",
        "strokeColor": "#707070",
        "strokeWidth": 0.2
    }
  },
  "pins": [
    {
        "packagePinId": "1",
        "name": "P1.00",
        "defaultType": "crystal_lf",
        "isClockCapable": false,
        "powerDomain": "peripheral",
        "notes": "XL1, GPIO",
        "side": "left"
    },
    {
        "packagePinId": "2",
        "name": "P1.01",
        "defaultType": "crystal_lf",
        "isClockCapable": false,
        "powerDomain": "peripheral",
        "notes": "XL2, GPIO",
        "side": "left"
    },
    {
        "packagePinId": "3",
        "name": "P1.02",
        "defaultType": "other_system",
        "isClockCapable": false,
        "powerDomain": "peripheral",
        "notes": "NFC1, GPIO",
        "side": "left"
    },
    {
        "packagePinId": "4",
        "name": "P1.03",
        "defaultType": "other_system",
        "isClockCapable": true,
        "powerDomain": "peripheral",
        "notes": "NFC2, GPIO",
        "side": "left"
    },
    {
        "packagePinId": "5",
        "name": "P1.04",
        "defaultType": "io",
        "isClockCapable": true,
        "powerDomain": "peripheral",
        "notes": "AIN0, TAMPC[0] ASO, GPIO",
        "side": "left"
    },
    {
        "packagePinId": "6",
        "name": "P1.05",
        "defaultType": "io",
        "isClockCapable": false,
        "powerDomain": "peripheral",
        "notes": "AIN1, RADIO[6], TAMPC[0] ASI, GPIO",
        "side": "left"
    },
    {
        "packagePinId": "7",
        "name": "P1.06",
        "defaultType": "io",
        "isClockCapable": false,
        "powerDomain": "peripheral",
        "notes": "AIN2, TAMPC[1] ASO, GPIO",
        "side": "left"
    },
    {
        "packagePinId": "8",
        "name": "P1.07",
        "defaultType": "io",
        "isClockCapable": false,
        "powerDomain": "peripheral",
        "notes": "AIN3, TAMPC[1] ASI, GPIO",
        "side": "left"
    },
    {
        "packagePinId": "9",
        "name": "P1.08",
        "defaultType": "io",
        "isClockCapable": true,
        "powerDomain": "peripheral",
        "notes": "EXTREF, CLKOUTFAST, GPIO",
        "side": "left"
    },
    {
        "packagePinId": "10",
        "name": "VDD",
        "defaultType": "power_positive",
        "notes": "VDD",
        "side": "left"
    },
    {
        "packagePinId": "11",
        "name": "P2.00",
        "defaultType": "io",
        "isClockCapable": false,
        "powerDomain": "mcu",
        "notes": "SPIM/SPIS00, SPIM/SPIS20, UARTE00, UARTE20, FLPR, eQSPI (FLPR)",
        "side": "left"
    },
    {
        "packagePinId": "12",
        "name": "P2.01",
        "defaultType": "io",
        "isClockCapable": true,
        "powerDomain": "mcu",
        "notes": "SPIM/SPIS00, SPIM/SPIS20, FLPR, eQSPI (FLPR)",
        "side": "left"
    },
    {
        "packagePinId": "13",
        "name": "P2.02",
        "defaultType": "io",
        "isClockCapable": false,
        "powerDomain": "mcu",
        "notes": "SPIM/SPIS00, SPIM/SPIS20, UARTE00, UARTE20, FLPR, eQSPI (FLPR), SWO",
        "side": "bottom"
    },
    {
        "packagePinId": "14",
        "name": "P2.03",
        "defaultType": "io",
        "isClockCapable": false,
        "powerDomain": "mcu",
        "notes": "FLPR, eQSPI (FLPR)",
        "side": "bottom"
    },
    {
        "packagePinId": "15",
        "name": "P2.04",
        "defaultType": "io",
        "isClockCapable": false,
        "powerDomain": "mcu",
        "notes": "SPIM/SPIS00, SPIM/SPIS20, UARTE00, UARTE20, FLPR, eQSPI (FLPR)",
        "side": "bottom"
    },
    {
        "packagePinId": "16",
        "name": "P2.05",
        "defaultType": "io",
        "isClockCapable": false,
        "powerDomain": "mcu",
        "notes": "SPIM/SPIS00, SPIM/SPIS20, UARTE00, UARTE20, FLPR, eQSPI (FLPR)",
        "side": "bottom"
    },
    {
        "packagePinId": "17",
        "name": "P2.06",
        "defaultType": "io",
        "isClockCapable": true,
        "powerDomain": "mcu",
        "notes": "SPIM/SPIS00, SPIM/SPIS21, FLPR, TRACECLK",
        "side": "bottom"
    },
    {
        "packagePinId": "18",
        "name": "P2.07",
        "defaultType": "io",
        "isClockCapable": false,
        "powerDomain": "mcu",
        "notes": "SPIM/SPIS00, SPIM/SPIS21, UARTE00, UARTE21, FLPR, SWO, TRACEDATA[0]",
        "side": "bottom"
    },
    {
        "packagePinId": "19",
        "name": "P2.08",
        "defaultType": "io",
        "isClockCapable": false,
        "powerDomain": "mcu",
        "notes": "SPIM/SPIS00, SPIM/SPIS21, UARTE00, UARTE21, FLPR, TRACEDATA[1]",
        "side": "bottom"
    },
    {
        "packagePinId": "20",
        "name": "P2.09",
        "defaultType": "io",
        "isClockCapable": false,
        "powerDomain": "mcu",
        "notes": "SPIM/SPIS00, SPIM/SPIS21, UARTE00, UARTE21, FLPR, TRACEDATA[2]",
        "side": "bottom"
    },
    {
        "packagePinId": "21",
        "name": "P2.10",
        "defaultType": "io",
        "isClockCapable": false,
        "powerDomain": "mcu",
        "notes": "SPIM/SPIS00, SPIM/SPIS21, UARTE00, UARTE21, FLPR, TRACEDATA[3]",
        "side": "bottom"
    },
    {
        "packagePinId": "22",
        "name": "VDD",
        "defaultType": "power_positive",
        "notes": "VDD",
        "side": "bottom"
    },
    {
        "packagePinId": "23",
        "name": "P0.00",
        "defaultType": "io",
        "isClockCapable": false,
        "powerDomain": "low_power",
        "notes": "GPIOTE30",
        "side": "right"
    },
    {
        "packagePinId": "24",
        "name": "P0.01",
        "defaultType": "io",
        "isClockCapable": false,
        "powerDomain": "low_power",
        "notes": "GPIOTE30",
        "side": "right"
    },
    {
        "packagePinId": "25",
        "name": "SWDIO",
        "defaultType": "debug",
        "notes": "SWDIO",
        "side": "right"
    },
    {
        "packagePinId": "26",
        "name": "SWDCLK",
        "defaultType": "debug",
        "notes": "SWDCLK",
        "side": "right"
    },
    {
        "packagePinId": "27",
        "name": "P0.02",
        "defaultType": "io",
        "isClockCapable": false,
        "powerDomain": "low_power",
        "notes": "GPIOTE30",
        "side": "right"
    },
    {
        "packagePinId": "28",
        "name": "P0.03",
        "defaultType": "io",
        "isClockCapable": true,
        "powerDomain": "low_power",
        "notes": "GPIOTE30, GRTC PWM",
        "side": "right"
    },
    {
        "packagePinId": "29",
        "name": "P0.04",
        "defaultType": "io",
        "isClockCapable": true,
        "powerDomain": "low_power",
        "notes": "GPIOTE30, GRTC CLKOUT32K",
        "side": "right"
    },
    {
        "packagePinId": "30",
        "name": "~{RESET}",
        "defaultType": "debug",
        "notes": "RESET active low",
        "side": "right"
    },
    {
        "packagePinId": "31",
        "name": "ANT",
        "defaultType": "rf_antenna",
        "notes": "Radio antenna port",
        "side": "right"
    },
    {
        "packagePinId": "32",
        "name": "VSS_PA",
        "defaultType": "power_ground",
        "notes": "RF ground",
        "side": "right"
    },
    {
        "packagePinId": "33",
        "name": "DECRF",
        "defaultType": "decoupling",
        "notes": "RF decoupling",
        "side": "right"
    },
    {
        "packagePinId": "34",
        "name": "XC1",
        "defaultType": "crystal_hf",
        "notes": "32 MHz input",
        "side": "right"
    },
    {
        "packagePinId": "35",
        "name": "XC2",
        "defaultType": "crystal_hf",
        "notes": "32 MHz output",
        "side": "right"
    },
    {
        "packagePinId": "36",
        "name": "VDD",
        "defaultType": "power_positive",
        "notes": "VDD",
        "side": "right"
    },
    {
        "packagePinId": "37",
        "name": "P1.09",
        "defaultType": "io",
        "isClockCapable": false,
        "powerDomain": "peripheral",
        "notes": "RADIO[0], TAMPC[2] ASO, GPIO",
        "side": "top"
    },
    {
        "packagePinId": "38",
        "name": "P1.10",
        "defaultType": "io",
        "isClockCapable": false,
        "powerDomain": "peripheral",
        "notes": "RADIO[1], TAMPC[2] ASI, GPIO",
        "side": "top"
    },
    {
        "packagePinId": "39",
        "name": "P1.11",
        "defaultType": "io",
        "isClockCapable": true,
        "powerDomain": "peripheral",
        "notes": "RADIO[2], TAMPC[3] ASO, AIN4, GPIO",
        "side": "top"
    },
    {
        "packagePinId": "40",
        "name": "P1.12",